{
	"version": "1.0.0",
	"released": "2026-04-05T17:59:05Z",
	"url": "https://github.com/MathisBls/R.E.P.O-injury-system/releases/download/v1.0.0/InjurySystem.dll",
	"sha256": "a926e735e8e1bd77266ebdb0e6fed4d16bce2c19ccf690d731ce8354a256f405",
	"size": 40448,
	"changelog": "**Full Changelog**: https://github.com/MathisBls/R.E.P.O-injury-system/commits/v1.0.0"
}
