{
	"version": "1.0.1",
	"released": "2026-05-08T13:41:20Z",
	"url": "https://github.com/MathisBls/R.E.P.O-injury-system/releases/download/v1.0.1/InjurySystem.dll",
	"sha256": "79a0e90b8abeb9e1ad2807e7a0d4265f5595b9e18e75e379206b02a435697c3b",
	"size": 40448,
	"changelog": "**Full Changelog**: https://github.com/MathisBls/R.E.P.O-injury-system/compare/v1.0.0...v1.0.1\r\n\r\nJust a bump"
}
